{
  "event": "uploads:processing",
  "message": "john.smith initialized file upload file.yml in project Translation Project within branch new-feature-1",
  "sent_at": "2025-02-07 16:44:04 UTC",
  "user": {
    "id": "24b9a53ad72e198ca332fba91bb95f57",
    "username": "john.smith",
    "name": "John Smith",
    "gravatar_uid": "1bc5edb4799fd8eec67c66122f47eb73"
  },
  "project": {
    "id": "b2abd3bd2c23ff0ac546e0a2d9aa0be1",
    "name": "Translation Project",
    "slug": "translation-project",
    "main_format": "yml",
    "project_image_url": null,
    "created_at": "2025-02-07 16:18:13 UTC",
    "updated_at": "2025-02-07 16:18:13 UTC",
    "point_of_contact": null
  },
  "branch": {
    "name": "new-feature-1"
  },
  "upload": {
    "id": "955ac73e72b75aae4fcaf2548798fe9c",
    "filename": "file.yml",
    "format": "yml",
    "state": "initialized",
    "created_at": "2025-02-07 16:18:13 UTC",
    "updated_at": "2025-02-07 16:18:13 UTC",
    "summary": {},
    "tag": null,
    "tags": [],
    "url": "http://www.example.com/accounts/company-account/projects/translation-project/uploads/955ac73e72b75aae4fcaf2548798fe9c?branch=new-feature-1",
    "user": {
      "id": "24b9a53ad72e198ca332fba91bb95f57",
      "username": "john.smith",
      "name": "John Smith",
      "gravatar_uid": "1bc5edb4799fd8eec67c66122f47eb73"
    }
  }
}